<?xml version="1.0" encoding="UTF-8" ?>
<library xmlns:xsi="http://www.w3.org/2001/XMLSchema-instance"
         xsi:noNamespaceSchemaLocation="library.xsd">
    <books>
        <book>
            <id>1</id>
            <title>Artemis Fowl</title>
            <authorId>1</authorId>
            <genreId>1</genreId>
            <isbn>978-1368036986</isbn>
            <quantity>4</quantity>
        </book>
        <book>
            <id>2</id>
            <title>Artemis Fowl: The Arctic Incident</title>
            <authorId>1</authorId>
            <genreId>1</genreId>
            <isbn>978-0-43945070-6</isbn>
            <quantity>3</quantity>
        </book>
    </books>
    <members>
        <member>
            <id>1</id>
            <firstName>Moussa</firstName>
            <lastName>Mikhail</lastName>
            <joinedDate>2023-01-20</joinedDate>
        </member>
        <member>
            <id>2</id>
            <firstName>John</firstName>
            <lastName>Doe</lastName>
            <joinedDate>2023-01-20</joinedDate>
        </member>
        <member>
            <id>3</id>
            <firstName>Alice</firstName>
            <lastName>Smith</lastName>
            <joinedDate>2023-01-20</joinedDate>
        </member>
        <member>
            <id>4</id>
            <firstName>Fake</firstName>
            <lastName>Person</lastName>
            <joinedDate>2023-01-20</joinedDate>
        </member>
    </members>
    <employees>
        <employee>
            <id>1</id>
            <firstName>John</firstName>
            <lastName>Doe</lastName>
            <salary>40000</salary>
            <hiredDate>2023-01-20</hiredDate>
        </employee>
        <employee>
            <id>2</id>
            <firstName>Alice</firstName>
            <lastName>Smith</lastName>
            <salary>40000</salary>
            <hiredDate>2023-01-20</hiredDate>
        </employee>
    </employees>
    <returnStatuses>
        <returnStatus>
            <id>1</id>
            <description>checked out</description>
        </returnStatus>
        <returnStatus>
            <id>2</id>
            <description>returned</description>
        </returnStatus>
        <returnStatus>
            <id>3</id>
            <description>late</description>
        </returnStatus>
    </returnStatuses>
    <checkouts>
        <checkout>
            <id>1</id>
            <memberId>1</memberId>
            <bookId>1</bookId>
            <employeeId>1</employeeId>
            <returnStatusId>1</returnStatusId>
            <checkoutDate>2023-01-20</checkoutDate>
            <dueDate>2023-01-20</dueDate>
            <returnedDate>2023-01-26</returnedDate>
        </checkout>
    </checkouts>
</library>